{"$schema":"https://json-schema.org/draft/2020-12/schema","$id":"https://schemas.ao-lore.example/public-release-policy-v0.1.schema.json","type":"object","additionalProperties":false,"required":["schema_version","included_files","included_prefixes","excluded_prefixes","executable_prefixes","binary_files","exceptions","limits","authority","policy_digest"],"properties":{"schema_version":{"const":"ao.lore.public-release-policy.v0.1"},"included_files":{"type":"array","items":{"type":"string"},"uniqueItems":true},"included_prefixes":{"type":"array","items":{"type":"string"},"uniqueItems":true},"excluded_prefixes":{"type":"array","items":{"type":"string"},"uniqueItems":true},"executable_prefixes":{"type":"array","items":{"type":"string"},"uniqueItems":true},"binary_files":{"type":"array","items":{"type":"string"},"uniqueItems":true},"exceptions":{"type":"array","items":{"type":"object","additionalProperties":false,"required":["path","sha256","reason_code","test_only"],"properties":{"path":{"type":"string"},"sha256":{"type":"string","pattern":"^[0-9a-f]{64}$"},"reason_code":{"enum":["inert_private_path","inert_secret_candidate","inert_network_locator"]},"test_only":{"const":true}}}},"limits":{"type":"object","additionalProperties":false,"required":["max_files","max_file_bytes","max_total_bytes","max_depth"],"properties":{"max_files":{"type":"integer","minimum":1},"max_file_bytes":{"type":"integer","minimum":1},"max_total_bytes":{"type":"integer","minimum":1},"max_depth":{"type":"integer","minimum":1}}},"authority":{"type":"object","additionalProperties":false,"required":["github_create","github_push","visibility_change","hosted_ci","release","deployment"],"properties":{"github_create":{"const":false},"github_push":{"const":false},"visibility_change":{"const":false},"hosted_ci":{"const":false},"release":{"const":false},"deployment":{"const":false}}},"policy_digest":{"type":"string","pattern":"^[0-9a-f]{64}$"}}}
