{
  "authority": {
    "deployment": false,
    "github_create": false,
    "github_push": false,
    "hosted_ci": false,
    "release": false,
    "visibility_change": false
  },
  "binary_files": [
    "tests/fixtures/ao_lore/docx/hierarchy-and-list.docx",
    "tests/fixtures/ao_lore/docx/links-and-notes.docx",
    "tests/fixtures/ao_lore/docx/media-and-drawing.docx",
    "tests/fixtures/ao_lore/docx/minimal-paragraph.docx",
    "tests/fixtures/ao_lore/docx/mixed-structure.docx",
    "tests/fixtures/ao_lore/docx/nested-table.docx",
    "tests/fixtures/ao_lore/ocr/blank.png",
    "tests/fixtures/ao_lore/ocr/clean.png",
    "tests/fixtures/ao_lore/ocr/decompression-bomb.png",
    "tests/fixtures/ao_lore/ocr/degraded.png",
    "tests/fixtures/ao_lore/ocr/dense.png",
    "tests/fixtures/ao_lore/ocr/encrypted.pdf",
    "tests/fixtures/ao_lore/ocr/excessive-pages.pdf",
    "tests/fixtures/ao_lore/ocr/faint.png",
    "tests/fixtures/ao_lore/ocr/malformed.pdf",
    "tests/fixtures/ao_lore/ocr/mixed.pdf",
    "tests/fixtures/ao_lore/ocr/nontext.png",
    "tests/fixtures/ao_lore/ocr/one-column.png",
    "tests/fixtures/ao_lore/ocr/oversized.png",
    "tests/fixtures/ao_lore/ocr/punctuation.png",
    "tests/fixtures/ao_lore/ocr/rotated-180.png",
    "tests/fixtures/ao_lore/ocr/rotated-270.png",
    "tests/fixtures/ao_lore/ocr/rotated-90.png",
    "tests/fixtures/ao_lore/ocr/skewed.png",
    "tests/fixtures/ao_lore/ocr/two-column.png",
    "tests/fixtures/ao_lore/ocr/uneven.png",
    "tests/fixtures/ao_lore/pdf/complex-table.pdf",
    "tests/fixtures/ao_lore/pdf/empty-document.pdf",
    "tests/fixtures/ao_lore/pdf/encrypted-document.pdf",
    "tests/fixtures/ao_lore/pdf/image-only-document.pdf",
    "tests/fixtures/ao_lore/pdf/long-boundary-document.pdf",
    "tests/fixtures/ao_lore/pdf/multi-page-sections.pdf",
    "tests/fixtures/ao_lore/pdf/repeated-header-footer.pdf",
    "tests/fixtures/ao_lore/pdf/simple-structure.pdf",
    "tests/fixtures/ao_lore/pdf/table-and-link.pdf",
    "tests/fixtures/ao_lore/pdf/truncated-document.pdf",
    "tests/fixtures/ao_lore/pdf/two-column-reading-order.pdf",
    "tests/fixtures/ao_lore/pdf/unicode-links-footnotes.pdf"
  ],
  "exceptions": [
    {"path": "tests/fixtures/ao_lore/docx/fixture-spec.json", "reason_code": "inert_network_locator", "sha256": "4c9adf48b90e500c2fae671c3610a35cb65170b4837241a8931ce25524cf7c27", "test_only": true},
    {"path": "tests/fixtures/ao_lore/parser-corpus-v0.1.json", "reason_code": "inert_network_locator", "sha256": "2a92b5a8e37553e41c064969f26405b0bfa72d313e381c300acfcd8e4a3f450e", "test_only": true},
    {"path": "tests/fixtures/ao_lore/pdf/fixture-spec.json", "reason_code": "inert_network_locator", "sha256": "d16b01951d861b5d06a845408c36fc554234e434afc427e41a6ba712c6bb9f3a", "test_only": true},
    {"path": "tests/fixtures/ao_lore/pdf/table-and-link.pdf", "reason_code": "inert_network_locator", "sha256": "cf12cf3c441b9b5171b82e24b16c25aa7edcdeed02bd2a41e321f7c07b2167c5", "test_only": true},
    {"path": "tests/fixtures/ao_lore/pdf/unicode-links-footnotes.pdf", "reason_code": "inert_network_locator", "sha256": "011c000aa7b53fe33c0133afba74316aa84539b8363334320cb2c5ed743a0cf5", "test_only": true},
    {"path": "tests/test_ao_lore_docling_pdf.py", "reason_code": "inert_network_locator", "sha256": "da901420800efcc8d0b168ccf97e8f2fa9cfd1497fd8fa7e70baafb4abacc65a", "test_only": true},
    {"path": "tests/test_ao_lore_document_evidence_contracts.py", "reason_code": "inert_network_locator", "sha256": "248066305a6066dd4fb5201f1c98726f8b09aa8bf9bb0582e12b947fc0884e63", "test_only": true},
    {"path": "tests/test_ao_lore_document_evidence_contracts.py", "reason_code": "inert_private_path", "sha256": "248066305a6066dd4fb5201f1c98726f8b09aa8bf9bb0582e12b947fc0884e63", "test_only": true},
    {"path": "tests/test_ao_lore_docx_benchmark.py", "reason_code": "inert_network_locator", "sha256": "0bdf4f8da5a8c731bdd0a588de02e1d5064c4cd5cb08a020c34bb0c5302d13db", "test_only": true},
    {"path": "tests/test_ao_lore_docx_ooxml.py", "reason_code": "inert_network_locator", "sha256": "66e7f50e9e9bacc792bc2e153cb3956f51887034693b0d89f03133c850f0d38b", "test_only": true},
    {"path": "tests/test_ao_lore_evidence_freshness_contracts.py", "reason_code": "inert_network_locator", "sha256": "8f6c2c27377b516a04e9623b3c112696907dc1d42d9c73538bf5921697329d65", "test_only": true},
    {"path": "tests/test_ao_lore_ocr_ir.py", "reason_code": "inert_private_path", "sha256": "87402a1723d886edc22026aca50b693de3a6ab3688cee1b2b860da927a048b04", "test_only": true},
    {"path": "tests/test_ao_lore_ocr_runtime.py", "reason_code": "inert_network_locator", "sha256": "51ae5b0f3775e8752e66509c786b26c377abf498025ef48d8fca8cf5f3ea4e23", "test_only": true},
    {"path": "tests/test_ao_lore_private_docx_domain.py", "reason_code": "inert_network_locator", "sha256": "25053cce862e46359c43841723a3d65dfad0e69131cf608bdb93534776b668aa", "test_only": true},
    {"path": "tests/test_ao_lore_public_release_contracts.py", "reason_code": "inert_private_path", "sha256": "97fab9120c23ea1415a539e1110bf3bce36cc38fea8fad28e5f073104463eaa7", "test_only": true},
    {"path": "tests/test_ao_lore_public_release_safety.py", "reason_code": "inert_network_locator", "sha256": "c78aefe9b9b5ef8475b6e3a38cecf3c967b1d6aaeaa968651ac351c109f7cd9b", "test_only": true},
    {"path": "tests/test_ao_lore_public_release_safety.py", "reason_code": "inert_private_path", "sha256": "c78aefe9b9b5ef8475b6e3a38cecf3c967b1d6aaeaa968651ac351c109f7cd9b", "test_only": true},
    {"path": "tests/test_ao_lore_public_release_safety.py", "reason_code": "inert_secret_candidate", "sha256": "c78aefe9b9b5ef8475b6e3a38cecf3c967b1d6aaeaa968651ac351c109f7cd9b", "test_only": true},
    {"path": "tests/test_ao_lore_sanitized_lifecycle_contracts.py", "reason_code": "inert_network_locator", "sha256": "b7c65e514106d543a2da693bd27a8600576c9f65512b82a4ebb35e6cf3000e30", "test_only": true},
    {"path": "tests/test_ao_lore_sanitized_lifecycle_contracts.py", "reason_code": "inert_private_path", "sha256": "b7c65e514106d543a2da693bd27a8600576c9f65512b82a4ebb35e6cf3000e30", "test_only": true},
    {"path": "tests/test_ao_lore_workspace_contracts.py", "reason_code": "inert_private_path", "sha256": "d2eecdc58c65985b89d95f5921c99715cd149821b8947edb9ae217e40623f7f1", "test_only": true}
  ],
  "excluded_prefixes": [
    ".ao-lore/",
    ".git/",
    ".worktrees/",
    "docs/evidence/",
    "docs/superpowers/"
  ],
  "executable_prefixes": [
    "scripts/",
    "tests/fixtures/ao_lore/knowledge/"
  ],
  "included_files": [
    ".gitattributes",
    ".github/workflows/ci.yml",
    ".gitignore",
    ".gitleaks.toml",
    "AGENTS.md",
    "CONTRIBUTING.md",
    "LICENSE",
    "Makefile",
    "README.md",
    "ROADMAP-ADDENDUM.md",
    "ROADMAP.md",
    "SECURITY.md",
    "ci-requirements.txt",
    "pyproject.toml"
  ],
  "included_prefixes": [
    "brain/",
    "docs/architecture/",
    "docs/contracts/",
    "docs/public-release/",
    "docs/recovery/",
    "docs/workflows/",
    "inbox/",
    "schemas/",
    "scripts/",
    "sources/",
    "src/",
    "tests/",
    "workflows/",
    "working/"
  ],
  "limits": {
    "max_depth": 12,
    "max_file_bytes": 16777216,
    "max_files": 4096,
    "max_total_bytes": 268435456
  },
  "policy_digest": "b16128cd10731ce4fd4deff139c34a543e12a94f23295fb8520aa32cbe17d973",
  "schema_version": "ao.lore.public-release-policy.v0.1"
}
